"Changes coming to Social Security on 1 May 2016 ""threaten the financial security"" of millions of Americans.",MOSTLY FALSE,
Photo depicts the Joint Chiefs of Staff giving President Obama the finger during the State of the Union address.,False,
A cannabis drug trial in France led to serious adverse effects in several subjects.,Mostly False,
An elderly birdwatcher had a physical altercation with an Oregon militant at the Malheur National Wildlife Refuge.,FALSE,
A photograph shows a baby great white shark.,FALSE,
The three winners of the $1.6 Powerball lottery have identified themselves on social media.,FALSE,
"Alan Rickman stated he envisioned sitting in a rocking chair at 80, reading 'Harry Potter' books to his grandchildren.",False,
A hedge fund manager named Jared Price won the $1.6 billion Powerball lottery.,FALSE,
"Queen Elizabeth said that she would ""take America back"" if Donald Trump gets elected president.",FALSE,
A Florida man was emasculated during an attempt to engage in sexual relations with a pit bull.,False,
An image shows musicians David Bowie and Lemmy Kilmister together at a party.,FALSE,
A photograph shows President Obama wearing American flag glasses after the 2016 State Of The Union Address.,MIXTURE,
"Kentucky county clerk Kim Davis was seated amongst several same-sex couples at 2016's ""State of the Union"" address.",False,
Actor Sean Penn was killed in January 2016.,FALSE,
The Pentagon purchased five million Powerball tickets at a cost of $10 million so they could buy more F-35s if they won.,False,
A photograph shows the living conditions of a group of pigs.,MIXTURE,
A Virginia lawmaker proposed a bill that mandates on-site physical examinations of children's genitals to determine which gendered bathroom they're authorized to use.,mixture,
"Former ""Full House"" star Ashley Olsen was murdered.",FALSE,
A $1.5 billion powerball lottery drawing scheduled for 13 January 2016 has been cancelled.,FALSE,
For the first time in history the North Atlantic is empty of cargo ships in-transit.,FALSE,
Peggy Noonan penned a 'Wall Street Journal' piece lauding Donald Trump.,Incorrectly Attributed,
A Denver man murdered a woman whose behavior was inspired by the #WasteHisTime hashtag on Twitter.,False,
Donald Trump said that he got more military training at prep school than a lot of people who actually joined the military.,MOSTLY TRUE,
"In 2012, 80% of murders stemmed from otherwise law-abiding citizens involved in interpersonal disputes.",Unproven,
"A man known as ""the booty tickler"" was arrested in Texas.",FALSE,
A photograph shows a frozen spider web.,FALSE,
A billboard in Finland states that it is legal for refugees to rape women.,FALSE,
"If a $1.3 billion dollar Powerball jackpot were shared with every American, we'd all get $4 million each.",False,
"Adolf Hitler said that the best way to control a people is to ""take a little of their freedom at a time.""",FALSE,
"The Clinton Foundation is a tax-free ""international money laundering scheme.""",Research in Progress <BR>,
"President Obama fired Rear Admiral Rick Williams for ""questioning"" the President's purported recent purchase of a mansion in Dubai.",False,
"A 15-year-old girl named Rosemary Gullett is missing from her Portland, Oregon, home.",outdated,
CNN host Fareed Zakaria posted a blog entry calling for white women to be raped by Islamic minority groups.,FALSE,
"Delaware has issued a new ""child support card"" that cannot be used to purchase items such as alcohol or cigarettes.",FALSE,
A new male contraception product allows a man to control the flow of sperm by flicking a switch.,MIXTURE,
A UFO portal was filmed over the Large Hadron Collider.,FALSE,
"A Pepsi employee in South Bend, Indiana was improperly terminated; while managers claimed he stole a case of soda, other employees confirmed the family's needs placed a fiscal burden on the company.",Undetermined,
"Janet Reno said in gun control that waiting periods and registration were a ""step,"" but ""prohibition of private firearms"" remained ""the goal"" of such measures.",False,
Bill Clinton told Tony Blair that he likes to punch slabs of ham.,FALSE,
Human traffickers are targeting young girls near the Great Lakes Crossing theater with a powdered drug that incapacitates them.,False,
A study proved you're thousands of times more likely to be killed by a doctor than a gun in the United States.,False,
"George Washington said that a free people need ""sufficient arms and ammunition to maintain a status of independence"" from their own government.",FALSE,
"According to a body language expert, a photograph of President Obama crying reveals he is a psychopath.",False,
A photograph shows an abandoned submarine in a desert.,FALSE,
Eric Holder participated in the armed occupation of a Columbia University ROTC office in 1970.,Mostly False,
A video shows Koko the gorilla spontaneously using sign language to issue a warning about climate change.,FALSE,
A browser extension can eliminate all mention of Donald Trump from a user's online experience.,true,
Michele Bachmann said that solar power drains the sun of heat.,FALSE,
A recent study revealed that one-third of pediatricians refuse to recommend the Gardasil HPV vaccine to patients.,Mostly False,
Hippopotamuses are the only animals that produce naturally pink milk.,FALSE,
Ammon Bundy posted a message on Twitter comparing himself to Rosa Parks.,FALSE,
Apple is eliminating the headphone jack for iPhone 7 in order to force users to purchase expensive Bluetooth equipment or proprietary headphones.,Mixture,
Two police officers in Georgia cumulatively killed more than 250 people and remain at large.,False,
You can get free Wendy's Frostys all year long if you purchase a $1 Frosty Key Tag.,Mixture,
"A riot broke out after a woman accidentally defecated while administering ""vodka butt shots"" on New Year's Eve.",False,
"Bill Cosby has received a pardon from President Obama for all ""current and future"" sexual assault charges.",FALSE,
A photograph depicts a Six Flags roller coaster under floodwaters in January 2016.,False,
"President Obama said that ""if we pass more gun laws, crime will go away.""",FALSE,
"Connecticut gun owners have started receiving ""gun confiscation letters.""",Mostly False,
Criminals are furtively wedging coins into car door handles in order to more easily break into vehicles.,False,
Chevy Chase died of a heart attack on 4 January 2016.,FALSE,
Michael Jordan will drop the price of all Air Jordan shoes to $19.99 in 2017.,FALSE,
New Hampshire state representative Josh Moore said that a woman shouldn't breastfeed in public if she doesn't want to be groped by men.,MIXTURE,
Comedian Bill Cosby committed suicide shortly after he was charged with sexual assault in December 2015.,FALSE,
Archaeologists dug up an 800-year-old alien cellphone in Austria.,FALSE,
Clint Eastwood said that Americans should be less concerned about offending each other and more concerned about offending god.,FALSE,
A photograph shows an x-ray of a 900-pound man.,FALSE,
"Photograph depicts the removal of Bill Cosby's Hollywood ""Walk of Fame"" Star.",False,
"Lawmakers ""slipped"" the repeal of county of origin labeling for meat into the December 2015 Omnibus Appropriations Bill.",Mixture,
A photograph shows a shark attacking a car on a flooded highway in Missouri.,FALSE,
"Hillary Clinton once said that ""women have always been the primary victims of war.""",TRUE,
Chipotle's 2015 outbreaks of foodborne illness were the work of pro-GMO bioterrorists.,Unproven,
A photograph shows a dog with a badly burned face.,FALSE,
Photograph depicts 12-year-old shooting victim Tamir Rice brandishing what appears to be two guns.,False,
A photograph shows a whale near a big wave surfer.,FALSE,
An image depicts Muslim men buying or stealing propane tanks at a Miami Home Depot.,False,
"President Obama has started confiscating guns ""by force.""",false,
Cold Stone Creamery is giving free or discounted ice cream to female customers that appear to be pregnant.,Mostly False,
Congressman Ted Yoho said that African-Americans should get only 3/5ths of a vote.,FALSE,
"McDonald's is getting rid of its ""Dollar Menu"" come 2016.",Mostly False,
"Actor Samuel L. Jackson said he hoped that the San Bernardino shooter was just some ""crazy white dude.""",MOSTLY TRUE,
"The JC Penney Portrait Studio in Fairview Heights, Illinois refused to take a photo with an American flag because it ""went against their belief.""",Mixture,
"GOP presidential candidate Ted Cruz ran a ""Netflix and Chill"" contest on his campaign web site.",FALSE,
One of the Jalal Brothers was shot while filming a prank video.,FALSE,
Donald Trump was removed from GOP primary ballots in five states.,FALSE,
"Organ donations occur while the donor is still alive, paralyzed by intravenous medication but not anesthetized.",Unproven,
Muslim Refugees threatened to slaughter their hosts at Hope Farms in South Africa.,MIXTURE,
"Property owners in New York City will be fined $250,000 for using ""improper pronouns"" due to new transgender laws.",MIXTURE,
"The gas station next to Higbie Bagels refused to sell tobacco to a serviceman who presented military ID, because the station's owners are anti-military.",Mostly False,
A new law makes it illegal for anyone under the age of 16 to ride a hoverboard.,mostly true,
"A photograph of Franklin, the one black character on 'Peanuts,' sitting alone on Thanksgiving documents that the creator of 'Peanuts'  was racist.",FALSE,
An asteroid will hit earth on Christmas Eve.,FALSE,
"College students are petitioning to get the song ""White Christmas"" banned due to racism.",MIXTURE,
Donald Trump suspended his presidential campaign in December 2015.,FALSE,
Lindsey Graham badmouthed the Republican Party after suspending his 2016 presidential campaign.,FALSE,
"Donald Trump tweeted that his ""grandparents didn't come to America"" to see the country taken over by immigrants.",FALSE,
Hillary Clinton said that Democratic voters were stupid and easily manipulated.,FALSE,
"A teenager named Hector Cruz contracted herpes by participating in the ""condom challenge"" social media trend.",False,
A photograph shows a wolf pack being led by the oldest and weakest members.,FALSE,
Syrian refugees are bringing a communicable flesh-eating disease into the United States.,False,
"Photographs show Donald Trump's sons, Donald Jr. and Eric, posing during a big game hunting trip.",True,
A photograph dating to 1998 shows a young Barack Obama as a member of the Black Panther Party.,False,
"A driver in Las Vegas shouted ""Allahu Akbar"" as she deliberately struck multiple pedestrians with her vehicle, and police have been instructed to suppress that detail of the story.",False,
Miss Colombia committed suicide after she the mistaken that accidentally crowned her Miss Universe was rectified.,FALSE,
Access to web sites operated by the campaign of candidate Bernie Sanders is blocked on some military bases.,Undetermined,
"Idaho Governor Clement Leroy ""Butch"" Otter said that poor people were genetically inferior to rich people.",FALSE,
A deceptive photograph shows a man perilously hanging by his feet from the edge of a high cliff.,MIXTURE,
"After being challenged by Michelle Obama, a former Marine wrote the First Lady a scathing letter.",MIXTURE,
"President Obama ""scrambled"" to ensure a proper Islamic burial for the San Bernardino shooters.",FALSE,
A fan was beaten up by moviegoers after spoiling the new Star Wars movie.,FALSE,
Disney has removed  items featuring Piglet from their stores due to pressure from the Muslim community.,FALSE,
Donald Trump failed to  place his hand over his heart during the playing of the U.S. national anthem at the beginning of a GOP debate.,FALSE,
The 7-10 split is the toughest split in bowling.,false,
Staffers on Bernie Sanders' campaign deliberately and improperly accessed information about the Hillary Clinton campaign during a brief (30-40 minute-long) data security lapse.,Mixture,
"Governor Paul LePage said that the ""worst possible thing"" you can do for the homeless is to offer them food and shelter.",FALSE,
Newt Gingrich tweeted about the 2 December 2015 San Bernardino shooting on 13 November 2015.,False,
Ted Cruz said that he literally talks to God.,FALSE,
"A December 2015 school shooting in Arapahoe County, Colorado was circumvented by an armed school resource officer.",mixture,
"Burger King has ""bowed to Sharia law"" and will no longer serve bacon at their restaurants.",Mostly False,
The IKEA furniture chain is selling a swastika-shaped table.,FALSE,
Muslims recently decided to celebrate the birth of the Prophet Mohammed on 24 December (Christmas Eve) in order to preempt Christmas.,False,
President Obama gave Syria $195 million to celebrate a Muslim holiday.,MIXTURE,
"A photograph shows ""the darkest baby in the world.""",FALSE,
"A sheriff in Carter County, Oklahoma issued a public letter urging citizens to arm themselves following a mass shooting in San Bernardino, California.",True,
"Residents in Waco, Texas booed Bill Nye The Science Guy for saying that the moon reflects light from the sun.",MIXTURE,
Jews are more often the victims of hate crimes than Muslims in the United States.,TRUE,
Toddlers killed more Americans than terrorists in 2015.,True,
Ferrero Rocher chocolates are commonly filled with maggots as depicted by a viral video.,MIXTURE,
"A single eruption from a volcano puts more than 10,000  times the amount of carbon dioxide into the atmosphere than all of mankind has produced.",FALSE,
An FBI field agent quietly warned a Missouri sheriff's department that a propane bomb attack is expected around Christmas.,False,
A can of cookie dough exploded inside a woman's vagina during a shoplifting incident at Walmart.,False,
"Patients can circumvent insurance company claim denials by requesting a specific form of documentation, as the insurance company will opt to simply cover the cost rather than provide the paperwork.",Mixture,
A photograph shows a chemtrail switch on a plane.,FALSE,
"ABC Family aired ""Christian content warnings"" before ""A Charlie Brown Christmas.""",False,
A photograph shows a vintage ad published in a 1950s Sears Catalog featuring a smiling family holding guns.,MOSTLY TRUE,
A Facebook status accurately reproduced a letter from and photo of a death row inmate who blamed his mother for poor parenting.,Legend,
Pope Francis uploaded a selfie to the Vatican's Instagram account.,FALSE,
"The term ""monkey wrench"" was originally used to insult the tool's African-American inventor Jack Johnson.",MIXTURE,
Islamic State (ISIS) militants have killed at least 38 babies and children with disabilities or Down syndrome.,Unproven,
New York State Judge Carolyn Walker-Diallo is Muslim and was sworn into office using a Quran.,True,
ISIS has issued a fatwa to kill American puppies.,FALSE,
"PS 169 Principal Eujin Jaela Kim banned the Pledge of Allegiance, Santa, and Thanksgiving.",Mostly False,
Residents of a North Carolina town rejected the local installation of a solar farm over fears the technology was harmful.,mixture,
President Obama achieved the lowest IQ score among all U.S. presidents of the last 100 years.,FALSE,
Drug testing welfare recipients (and then disqualifying those who fail from collecting benefits) is an effective method for saving taxpayer money.,INSUFFICIENT DATA,
A judge has called for the FBI and U.S. Marshals to arrest the President.,False,
A 23-year-old Florida university student was arrested for marijuana possession and coerced into acting as an informant; she was subsequently murdered by drug dealers who discovered she was wearing a wire.,True,
A visually impaired man strangled his girlfriend because she was unable to make eye contact with him.,False,
"Middle Eastern men purchased dozens of burner cell phones at Walmarts in and around Lebanon, Missouri (ostensibly to carry out terror attacks); at the same time, multiple stores reported propane tank thefts.",Mostly False,
A convicted pedophile rapist was caught using a clown costume to hide in a child's room.,FALSE,
Stanley Kubrick admitted in an interview that he helped NASA fake the U.S. moon landings.,FALSE,
"California has banned a popular type of ammunition, the .45 ACP.",false,
"Mexican drug cartel leader Joaquin ""El Chapo"" Guzman has threatened to wage war against ISIS.",FALSE,
"Petitioners demanded singer Adele admit her success is due to ""white privilege"" and donate her wealth to the Black Lives Matter movement.",Unproven,
Atheists are trying to ban Bibles from all hotel rooms.,Mixture,
The British government banned the Lord's Prayer in cinemas but then allowed Islamic messages to appear on London buses.,MIXTURE:,
"A lawyer for Tashfeen Malik asked the media not to show photographs of her face because doing so was offensive to Muslims, and MSNBC host Melissa Harris-Perry criticized the New York Times for publishing such pictures.",FALSE,
A Facebook message requesting Christmas cards for 8-year-old burn victim Safyre Terry is legit.,TRUE,
Talk show host Oprah Winfrey is pregnant with her first child at 61.,FALSE,
President Jimmy Carter banned Iranian nationals from entering the U.S. in a manner similar to Donald Trump's proposal to ban the entry of  Muslims.,Mixture,
A photograph shows President Obama holding a rocket launcher in a car with Abu Bakr al-Baghdadi.,FALSE,
Donald Trump stated he would contact Bill Gates to shut down or ban the internet.,Mixture,
The legal drinking age has been raised to 23.,FALSE,
Donald Trump is related to Adolf Hitler.,FALSE,
Jimmy Carter said that medical marijuana cured his cancer.,FALSE,
Donald Trump has been disqualified from running for President due to his comments about Muslims.,FALSE,
Quoting the Bible will become illegal in Cincinnati as of 9 December 2015.,False,
"A photograph depicts a ""pro-ISIS rally"" held in Dearborn, Michigan, in December 2015.",false,
Vastly more mass shootings have taken place during President Obama's administration than that of any other recent President.,false,
The Centers for Disease Control have issued a warning concerning used condoms being repurposed as hairbands.,false,
A photograph shows three buildings in New York decorated with window crosses for Easter in 1956.,true,
Keanu Reeves posted a message on his personal Facebook page about the difficulties he has overcome in life.,INCORRECTLY ATTRIBUTED,
" A restaurant customer named Jason Naglich wrote ""Tip for U.S. Citizens Only"" on his bill and stiffed his waitress.",undetermined,
A photograph shows insects embedded in a dog's mouth.,mixture,
The family of Anne Frank sought (and was denied) refugee status in the United States.,TRUE,
Boston Marathon bombers Tamerlan and Dzokhar Tsarnaev entered the United States as refugees.,mixture,
Jennifer Aniston once reconnected a homeless 15-year-old single mother with her parents.,false,
 A baby died at an unnamed medical facility because its parents refused to allow a black nurse to care for the child.,unproven,
Photographs show a banana that has been injected with human blood in order to spread HIV.,false,
A photograph shows two extremely muscular female bodybuilders.,false,
"The zodiac is about to change to include a ""new"" star sign, Ophiuchus.",false,
Wisconsin governor Scott Walker said that Labor Day should be replaced with Patriots Day.,false,
"By participating in a Facebook ""secret sister"" gift exchange, you'll receive 36 gifts, books, or bottles of wine in exchange for one $10-15 contribution.",false,
"A Spirit Airlines employee was rude to a soldier, charged him for a carry-on bag, and told his father that the airline ""doesn't cater to the military.""",Undetermined,
Photographs show a dog saving an abandoned newborn child.,undetermined,
Pope Francis has endorsed Bernie Sanders for President.,false,
A woman was arrested at a WalMart store for masturbating with a sausage.,false,
"A ""female physician in Munich"" penned an alarming warning letter about refugees.",Unproven,
"Donald Trump said in 1998 that he would one day run as a Republican because they are the ""dumbest group of voters.""",false,
A 2007 Harvard University study proved that areas with higher rates of gun ownership have lower crime rates.,false,
A photograph depicts a new method discovered by Russian scientists to turn black skin white instantly.,false,
Facebook doesn't consider military emblems appropriate and deletes them from Facebook pages.,FALSE,
"The United States has the third-highest rate of homicides worldwide, but drops dramatically in the rankings if four major cities are excluded from the stats.",MOSTLY FALSE,
"The same crying woman appears in photos taken at the scenes of massacres in Sandy Hook, Aurora, Boston, and Oregon.",false,
President Obama forgave Al Sharpton's huge tax debt.,unproven,
"Donald Trump violated Palm Beach ordinances by putting up an outsized U.S. flag and pole, then donating the money he was fined to veterans' organizations.",mostly true,
A DNA test confirmed that actor Bryshere Y. Gray is the biological son of rap mogu Jay-Z.,false,
"Photographs show a cache of weapons uncovered by the Coast Guard in Greece, disguised as furniture and headed for European refugee camps.",false,
Victims of domestic violence can effectively send out a secret signal for help by drawing black dots on their palms.,mixture,
Drivers in China commonly intentionally kill pedestrians in hit-and-run accidents.,unproven,
"Vice President Joe Biden said that ""the Germans"" bombed Pearl Harbor.",FALSE,
Actor (and former California governor) Arnold Schwarzenegger has passed away of a heart attack.,false,
Chris Christie said that teachers should make only minimum wage plus bonuses.,false,
Four of Donald Trump's children would have been deported under his strict policy proposal against birthright citizenship.,mixture,
A black woman named Amelia Bassano has been proved the true (uncredited) author of all of William Shakespeare's plays.,false,
Michele Bachmann compare the Great Wall of China to a U.S.-Mexico border fence.,false,
A Hawaii state official recently came forward with proof that President Barack Obama's birth certificate was not legitimate.,false,
"Margaret Sanger said ""Slavs, Latin and Hebrew immigrants are human weeds""  in need of eradication.",false,
A gang of Muslim women beat up a French bikini-clad woman because her swimwear violated their religious beliefs.,false,
A man whose car bore personalized license plates reading 'NO PLATE' received notices for thousands of unpaid parking tickets.,TRUE,
President Obama has changed the Oath of Allegiance for naturalized citizens to remove a vow to defend the U.S.,mostly false,
"The Minions in the film ""Despicable Me"" were inspired by photographs of young Nazi poison gas test subjects.",false,
"Samuel Adams has produced HeliYum, a helium-infused brand of beer.",false,
"A photograph shows a jar of Gerber brand ""Big Mac and Fries"" baby food.",FALSE,
Photograph shows Barack Obama kissing British prime minister David Cameron.,false,
An ambush near Boston recently killed  Guard troops.,satire,
"Temple Baptist Church was built on land sold for fifty-seven cents, the amount saved by a little girl who had been turned away from its Sunday school.",legend,
Message lists legislation passed by the state of Oklahoma.,true,
The eleven points on the maple leaf of Canada's flag represent the number of Canadian provinces and territories.,false,
"In accordance with a requirement of their original Royal Charter, the Hudson's Bay Company of Canada makes annual payments of elk and beaver pelts to the Queen of England.",false,
Medicare regulations require that doctors ask patients whether they own guns.,false,
Aldi is giving away 40% off grocery coupons to Facebook users.,False,
President Obama has signed an executive order banning the possession and sale of Confederate flags.,false,
Baby carrots are not made from deformed full-sized carrots that have been soaked in chlorine.,mostly false,
"Dearborn, Michigan, has become the first U.S. city to implement Sharia law.",false,
A gang member died after trying to gold plate his genitals.,FALSE,
Schoolkids are smoking and injecting crushed bedbugs to get high from a hallucinogenic substance they contain.,false,
Account of a 10-year-old boy's death explains dry drowning and its symptoms.,partly true,
"Hyland's Teething Tablets have been discontinued for causing ""adverse events"" in children.",true,
Production of Coors Light beer has been halted due the brew's being contaminated with cocaine.,false,
A child developed third-degree sunburn after using Dollar General brand spray-on sunblock.,unproven,
Swabbing ticks with liquid soap is a recommended and effective method for removing them.,mixture,
X-rays document a man in China whose body became riddled with tapeworms due to his consumption of sashimi.,false,
A photograph shows a raccoon riding an alligator.,UNPROVEN,
List reproduces various statements made by Hillary Clinton.,mixture,
Human trafficking rings are using job interviews to lure college students.,false,
Automobile components emit dangerous levels of cancer-causing benzene fumes.,unproven,
Photograph shows Hillary Clinton shaking hands with Usama bin Laden.,false,
A 1955 photograph from Time magazine depicts that era's 'perfect body.',false,
Caitlyn Jenner regrets transitioning to female and wishes to de-transition.,false,
Taco Bell is closing all locations.,False,
Nabisco is issuing Spam-flavored Oreos.,false,
Breast milk is glittery gold under a microscope.,mixture,
The father of Chelsea Clinton's husband is a former congressman who pled guilty to fraud charges.,true,
Barack Obama is the only U.S. president not to lay a wreath at Arlington National Cemetery on Memorial Day.,False,
Memorial Day began with a May 1865 ceremony held by former slaves to honor Union war dead.,mostly false,
