"Donald Trump mentioned ""seven eleven""  rather than ""nine eleven"" when referring to the September 11 terrorist attacks.",true,
Target caved to pressure from President Obama and LGBT groups and instituted a store-wide policy allowing transgender employees and shoppers to use the bathroom that matched their gender identity.,Mixture,
Colin Powell urged people to vote for Donald Trump so that they could put a conservative on the Supreme Court.,MISATTRIBUTED,
Costco lied about carrying cage-free eggs in their stores.,Mostly False,
A photograph shows hundreds of Christians who were burned alive by Muslims in Nigeria.,MISCAPTIONED,
Multiple news outlets reported that primary voters in New York claimed their votes were switched from Bernie Sanders to Hillary Clinton.,False,
A new law in South Africa requires people with HIV to mark their genitals.,FALSE,
Photographs and videos show a pair of gay lions having sex.,mixture,
"Ret. Sgt. Gregory Hayes beat two Syrian refugees to death after they raped his daughter, and now faces life in prison.",false,
"""American Chopper"" star Paul Teutul, Sr. was killed in a motorcycle accident in April 2016.",FALSE,
"Disney is replacing its popular ""Tower of Terror"" attraction with ""Elsa's Ice Castle.""",False,
A boy is suing his parents for allowing him to be born with red hair.,false,
"The dairy industry invented a new way to abuse cows, and is now cutting holes in them to improve milk production.",MIXTURE,
"New York voters will be turned away from the polls if they wear shirts endorsing specific candidates, and polling hours have been deliberately shortened to suppress primary votes.",Mostly False,
Joint Chiefs of Staff Chairman Joseph Dunford announced his retirement with a fiery political resignation speech.,false,
A McDonald's employee was arrested for masturbating into the restaurant's condiments.,FALSE,
A new study published by Oxford University researchers proved that women with big butts are smarter and healthier.,Mostly False,
"A photograph shows a lush green farm in the shadow of a looming, snow-covered mountain.",FALSE,
"NC police tased and ""brutally ejected"" a woman from a ladies' restroom because they thought she was transgender.",FALSE,
"A photograph shows a ""Wecome to Australia"" sign informing immigrants that they have to work to earn money.",FALSE,
A man deleted his entire company with one line of code.,false,
Coca-Cola has bought the rights to Dr Pepper and will be discontinuing production of the latter soft drink.,false,
Photograph depicts massive rally for Bernie Sanders in Washington Square Park in April 2016.,Miscaptioned,
"A video shows Oscar, the world's first modular life form.",FALSE,
Former Republican candidate Dr. Ben Carson doesn't remember running for president.,FALSE,
"The Council for American-Islamic Relations (CAIR) wants to cancel Memorial Day and replace it with a holiday honoring ""Muslim terrorists.""",Mostly False,
A photograph shows a female wolf protecting a male's throat during a fight.,miscaptioned,
A California man was arrested in April 2016 for dressing in women's clothes and surreptitiously filming women in a public bathroom.,Mostly False,
"Scientists have created ""kaleabis,"" a cross of kale and marijuana.",FALSE,
"The man leading opposition to a controversial ""bathroom bill"" in North Carolina is a registered sex offender.",mixture,
A photograph shows an obese tiger.,FALSE,
Car headrests were deliberately designed to be removed so that they can be used to smash windows during emergencies.,MOSTLY FALSE,
"Cocktails are a wholly American invention, popularized by Prohibition.",mixture,
"92-year-old Pam Nelson of Victoria, Texas, was unable to vote because of new laws requiring voters to present ID.",false,
"A photograph shows Paul McCartney wearing a t-shirt with the word ""adopt"" written across the chest.",FALSE,
"It is illegal to wear Anonymous (i.e., Guy Fawkes) masks in public in the United States.",FALSE,
Photograph depicts a young woman's revealing (and inappropriate) high school prom dress.,Unproven,
A woman ate her grandchild after smoking bath salts.,FALSE,
The entire Goldman Sachs executive board was arrested by the FBI.,FALSE,
Ted Cruz tried to ban dildoes while serving as solicitor general of Texas.,Mostly False,
"Pilot Travel Center in Mebane, North Carolina installed urinals in the ladies' room.",False,
A photograph taken from the International Space Station shows a Space Shuttle leaving Earth.,mixture,
President Obama encouraged schools to teach the Quran for extra credit.,False,
The United Nations will kill all Americans who refuse to turn over their guns.,False,
Photographs show a white tiger with Down syndrome.,MIXTURE,
"New York State Gov. Andrew Cuomo issued a multi-state ""travel ban"" involving states with ""lax gun laws.""",False,
A letter criticizing students at Oxford University for their desire to remove a statue of Cecil Rhodes was penned by a school official.,FALSE,
A law in Iowa forbids people from kissing for more than five minutes.,UNPROVEN,
"The philosopher Socrates said ""when debate is lost, slander becomes the tool of the loser.""",Unproven,
A photograph showing a woman walking down a nearly empty supermarket aisle was taken in Venezuela.,FALSE,
"An ""abortionist"" strangled an infant following a failed saline abortion, while other clinicians failed to intervene.",mixture,
Ted Cruz and his wife are cousins.,FALSE,
A video shows a snowboarder being chased by a bear.,unproven,
"A meme claimed that a British Muslim man named Sajid Muhammed set a woman on fire for eating a bacon sandwich, and was jailed for only two years.",False,
A mother admitted on Facebook to sleeping with and becoming pregnant by her 15-year-old son.,False,
Country music singer Merle Haggard left his entire estate to an LGBT group.,FALSE,
"A patron paid the restaurant tab for seven different families and left his server a $1,500 tip at a Denny's.",unproven,
"A month after Hillary Clinton was declared the winner of Nevada's caucuses, Bernie Sanders retroactively collected more delegates to win the state.",mixture,
"After losing the Wisconsin Republican primary, Donald Trump threatened to sue everyone in that state.",false,
"Bruce Springsteen cancelled a show in Greensboro, North Carolina, over the state's so-called 'bathroom law.'",true,
Arizona's Prescott College is forcing students to pay a $30 fee for an undocumented immigrant scholarship fund.,mixture,
New or expectant moms can receive a generous free meal from their local Chick-fil-A.,Mostly false,
The horse's head that appeared in an iconic scene in the film  was real.,True,
Mississippi has passed a bill granting churchgoers the right to shoot and kill citizens at will.,Mostly False,
"Facebook has not one, but two filtered message inboxes where Messenger messages may not be easily seen.",True,
"An astrophysicist warned that a ""newly discovered Planet X"" could wipe out all life on Earth as early as April 2016.",False,
"John F. Kennedy warned of what would happen ""one day"" after he was ""long gone"" in an eerily predictive manner.",False,
A Naples Zoo keeper was killed while attempting to sexually assault a 12-foot long reptile.,false,
A woman sliced a rapist's genitals off and forced him to eat them.,False,
An ISIS attack claimed seven lives in a U.S. town.,False,
Taxpayers footed the bill for prayer rugs at a St. Cloud school district after a lawsuit was brought by CAIR.,False,
A photograph shows a group of Texas college students protesting the rising cost of education by writing their debts on their graduation caps.,FALSE,
"As Secretary of State, Hillary Clinton artificially depressed Haiti's minimum wage; that action was part of a larger plan by the Clinton Foundation to profit from the country.",mixture,
A photograph shows a horse with markings on its coat depicting an image of a wolf.,FALSE,
A photograph shows William Harley and Arthur Davidson unveiling their first motorcycle in 1914.,FALSE,
HUD is attempting to pass a law banning tiny houses and RV living.,False,
"The Corrections Corporation of America (CCA) said that cannabis legalization would harm their profits, and they spend $1 million per year fighting changes to marijuana laws.",Mixture,
A touching transcript reproduces a Russian soldier's last words before he ordered an airstrike on himself to kill ISIS members in Syria.,undetermined,
A woman shot and killed her boyfriend after an April Fool's Day marriage proposal prank.,False,
Republican presidential candidate John Kasich said that he would abolish teachers' lounges.,mixture,
An A-list celebrity had car trouble in your town and afterwards praised the locals for being awesomely helpful.,False,
A photograph shows a 736-pound catfish caught in the Mississippi River.,FALSE,
Visitors to Hollywood's Walk of Fame regularly defecate on Donald Trump's star.,False,
Tattoos are banned at all Disney theme parks.,FALSE,
A woman is suing a tampon manufacturer for 'stealing' her daughter's virginity.,false,
Bernie Sanders wants to tax churches at a rate of 90 percent.,False,
Hillary Clinton was arrested by the FBI on 1 April 2016.,FALSE,
"Bernie Sanders said that ""the heritage of Castro will be felt for generations to come"" during a 1985 radio interview.",FALSE,
"Redbox is hiring ""kiosk ambassadors"" to man their red booths.",False,
The Weather Channel announced that it will only use the Celsius temperature scale.,FALSE,
Pimm's signed a sponsorship deal to display its logo on Big Ben.,FALSE,
Donald Trump announced that his 2016 Presidential campaign was an April Fool's Day joke.,FALSE,
All Trader Joe's grocery stores will be closed by 2017.,FALSE,
A photograph depicts a sign on a unisex Kroger bathroom addressing recent controversies about gender and restroom use.,True,
A clip from the show 'Arrested Development' featuring Ron Howard is proof that the 1969 moon landing was fake.,FALSE,
Rep. Debbie Riddle proposed a breastfeeding ban on women with large breasts.,FALSE,
Kohl's declared bankruptcy and is closing all its stores.,False,
"Photograph shows Titus, an Albanian pitbull with cheetah-like spots.",false,
Donald Trump ex-wives admitted that the Republican Presidential candidate forced them to have abortions.,FALSE,
"Bernie Sanders purchased a $172,000 luxury car with campaign donations.",FALSE,
Donald Trump said that he doesn't like Muslims because they killed Jesus.,FALSE,
"Donald Trump said there should be ""some form of punishment"" for women who have abortions.",Mixture,
Photograph shows crates in which calves are kept immobilized for six weeks before they are slaughtered for veal.,FALSE,
Facebook is censoring posts about Bernie Sanders and the hashtag #FeelTheBern.,False,
"A video shows a 10-year-old Amy Winehouse singing ""What A Difference A Day Makes.""",FALSE,
"Stanford University rejected all applicants for the Class of 2020, cementing their status as an upper-crust institution.",False,
"After unlocking an iPhone belonging to one of the people involved in the San Bernardino shooting, the FBI ruined the device by spilling water on it.",FALSE,
A 101-year-old Italian woman gave birth after an ovarian transplant.,False,
The media covered up an incident in San Bernardino during which several Muslim men fired upon a number of Californian hikers.,False,
Bernie Sanders flies coach while traveling for his presidential campaign.,mixture,
"A video featuring the ""Best Volleyball Blocks Ever"" uses footage of a real volleyball game.",FALSE,
"The Temple of Baal is being rebuilt in New York and London as an operable house of worship, with more such temples to follow.",Mostly False,
Aaron Rodgers and Olivia Munn endorsed Bernie Sanders at a rally in Wisconsin.,FALSE,
Most refugees are young adult males.,Mostly False,
"Whataburger is holding a ""Dollar Burger Day"" promotion on 29 March 2016.",FALSE,
Singer Kehlani was found dead in her home of an apparent suicide on 28 March 2016.,FALSE,
"Stephanie Cegielski, Donald Trump's top strategist, wrote an open letter to the Republican candidate's supporters.",MIXTURE,
"Chobani CEO Hamdi Ulukaya vowed to ""drown the United States in Muslims"" and is ""importing them to Idaho 300 at a time to work in his factory.""",Mostly False,
"On either 20 April or 29 May 2016, a very rare ""green moon"" will be visible in the night sky.",False,
A photograph shows two women holding anti-Father's Day signs.,FALSE,
"Alaska, Hawaii, Washington states are overwhelmingly ""white"" and ""rural.""",false,
"Actor Gabourey Sidibe has died of an ""apparent asthma attack.""",false,
"'Beetlejuice 2,' a sequel to the 1988 comedy horror film, is coming to theaters soon.",False,
"Bernie Sanders's campaign bused fake supporters to rallies, caucuses, and events in order to prevent legitimate attendees from being able to participate.",Mostly False,
A photograph show a solar eclipse over the ocean.,FALSE,
A photograph shows musician Snoop Dogg in an Easter Bunny costume.,FALSE,
Account describes a cab driver taking an elderly woman to a hospice on the last ride of her life.,legend,
"The name of the Christian holy day known as ""Good Friday"" derives from the term ""God's Friday.""",false,
"Getting your hair washed at a beauty salon can, in rare cases, increase the chances of a stroke.",true,
A driver drove into a wall painted to look like a tunnel in a manner similar to Looney Tunes' Road Runner cartoons.,False,
Milk-Bone dog treats cause cancer in one of every two dogs that eat them.,False,
"Maricopa County Recorder Helen Purcell was married to Joe Purcell, a former Lieutenant Governor of Arkansas who served under Bill Clinton.",FALSE,
Ronald Reagan went golfing after the 1983 terrorist bombing of a U.S. Marines barrack in Beirut.,FALSE,
"Congressman Ryan Zinke is offering an ""ISIS Hunting Tag"" to people who donate to his campaign.",UNPROVEN,
The FDA classified walnuts as drugs.,False,
"Students at Emory University were offered ""emergency counseling"" after pro-Trump graffiti appeared overnight in campus ""safe spaces.""",Mostly False,
A white strawberry that tastes like pineapple is available in certain markets.,true,
"Nutella is ""toxic"" and contains the ""harmful"" ingredients vanillin and MSG.",False,
"Cadbury has entirely eliminated use of the word ""Easter"" on the packaging of their chocolate candy products.",FALSE,
A family of three drowned when they neglected to close their car's sunroof before going through a carwash.,false,
"As President Obama departed Cuba, dozens of prospective refugees clung to the wings of Air Force One.",False,
"Donald Trump ""spilled the beans"" on Heidi Cruz, saying that she used to work as a call girl.",FALSE,
Donald Trump said that as president he would build a wall along the U.S.-Canadian border.,FALSE,
A photograph shows the preserved claw of a dinosaur called troodon.,FALSE,
A young Mormon missionary has survived three terrorist attacks in three countries.,mixture,
The Food and Drug Administration (FDA) banned the sale of cannabidiol (CBD) oils because a drug company is interested in marketing them.,False,
"Ed Trice successfully lobbied to have all standardized math tests in the country changed after his daughter's ""correct"" answer to the question ""What's the largest number you can represent with 3 digits?"" was marked wrong.",unproven,
"Pantene shampoo and conditioner leave a build-up on hair that causes it to heat up and ""smoke"" when combined with highlight foils.",false,
The Colorado Rockies will sell pot brownies at Coors Field concession stands .,False,
Police are asking meth users to bring in their drugs because they might be contaminated with Ebola.,MIXTURE,
A photograph shows President Obama holding a Che Guevara t-shirt.,FALSE,
"Opossums kill thousands of ticks each week, inhibiting the spread of Lyme Disease to humans.",mostly true,
A video shows Walmart-brand water turning to a dangerous gelatin substance.,FALSE,
Statistician Nate Silver predicted Bernie Sanders would sweep eight states and win the Democratic nomination.,Unproven,
"Autism has now been included among the known side effects of the  DTaP (Diphtheria, Tetanus, and acellular Pertussis) vaccine.",false,
Plans to make a sequel to the movie 'Step Brothers' were announced in March 2016.,FALSE,
"A video shows the ""moment the explosion"" of a terrorist attack occurred in the Brussels airport on 22 March 2016. .",FALSE,
The U.S. Department of Interior sent out an official news release stating that President Obama was reducing the size of the Navajo Reservation.,FALSE,
A photograph captures President Obama pointing at a nude painting of Donald Trump.,FALSE,
Bernie Sanders isn't on the New Jersey primary ballot.,Mostly False,
A photograph shows two children holding a 'F*CK Donald Trump' sign at a Chicago rally.,UNDETERMINED,
Hillary Clinton was disbarred and stripped of her license to practice law.,False,
An image depicts rare purple ladybugs found only in Hawaii.,False,
"An ""alien mummy"" was recently unearthed in a pyramid, and scientists cannot explain its origins.",False,
Images reproduce contradictory statements from U.S. senators Mitch McConnell and Harry Reid about the President's prerogative in appointing Supreme Court justices.,true,
A photograph shows a pilot taking a selfie out of a plane window.,FALSE,
A recall was issued for Bumble Bee Tuna after human remains were found in the product.,FALSE,
Doors singer Jim Morrison has been found alive in a Paris retirement home.,false,
Ted Cruz and Marco Rubio urged people to vote for a Democrat if Donald Trump wins the 2016 Republican presidential nomination.,FALSE,
Republicans in Alabama filed a bill which (if passed) would prohibit people who owned cars from receiving food stamps.,False,
Keith Richards once pulled a knife on Donald Trump.,MIXTURE,
"Hillary Clinton overlooked Benghazi victims when she said that ""we didn't lose a single person in Libya"" during a campaign event on MSNBC.",Mostly False,
Actor Andrew Lincoln's father was in a 1972 plane crash in the Andes mountain and survived by eating the other passengers.,FALSE,
Floyd Mayweather wore a Muslim headscarf to a Donald Trump rally.,FALSE,
The government buried news of weather modification in the classifieds section of a small newspaper.,Mostly False,
Gardeners can create a hybrid kiwi banana fruit by planting a piece of a banana and a piece of a kiwi in the same pot.,FALSE,
"Jason Brian Dalton, who as accused of killing six people during a shooting spree in February 2016, is suing Uber for $10 million in damages.",false,
Zantac (ranitidine) or similar acid reflux medications cause users to falsely test positive for meth use.,Mixture,
"Facebook users should not accept a video entitled ""Sonia Disowns Rahul"" because it contains a malicious virus.",FALSE,
Harrison Ford endorsed Donald Trump via a photograph in which he held up a campaign sign.,False,
A woman encountered kidnapping scouts at a Houston Target.,Unproven,
"Taxpayers paid more than $40,000 for Sasha and Malia Obama's state dinner dresses.",MIXTURE,
"Muslims comprise 1% of the population, 0.5% of mass shooters, and 10% of doctors in the U.S.",mostly false,
A resolution passed in March 2016 forces residents of a Texas county to pay reparations to black citizens.,False,
"USPS  ""Forever Stamps"" are considered ""second-class mail,"" and items sent with those stamps are processed more slowly.",False,
"Photographs show an attempted robbery in El Paso, Texas, that ended with all of the assailants shot by their would-be victim.",miscaptioned,
Bernie Sanders plans on banning trucks in the United States.,MIXTURE,
A viral video showing molten copper being poured over a Big Mac definitively proves that McDonald's food is indestructible and indigestible.,mostly false,
Ted Cruz wants to ban the tritone interval in music due to its association with the devil.,FALSE,
Hillary Clinton admitted her Iraq War vote was elicited in exchange for money provided by the Bush administration to help rebuild New York City after the 9/11 attacks.,False,
"The FDA has banned all e-juice for electronic cigarettes, effective July 2016.",False,
Notorious criminal Charles Manson has endorsed Donald Trump for president.,False,
Donald Trump supporters were photographed wearing Nazi-style armbands.,Mostly False,
Ads on Craigslist sought to recruit paid protesters to swarm Donald Trump rallies.,Unproven,
Kentucky has passed a bill banning interracial marriages.,MIXTURE,
"Donald Trump said in the good old days, protesters were harshly dealt with and carried away on stretchers.",Mostly True,
Bernie Sanders tweeted a scathing retort to Donald Trump after the latter accused the former's supporters of inciting violence at Trump rallies.,False,
Nylabone brand pet products are toxic and cause dogs to have seizures.,unproven,
"UNESCO declared India's national anthem, 'Jana Gana Mana,' to be the world's best.",FALSE,
Taco Cabana Restaurants have banned Donald Trump supporters,FALSE,
A video provides evidence that a protester who was arrested at a Donald Trump rally was a member of ISIS.,FALSE,
"Nancy Reagan once said ""It is appalling to see parades in San Francisco and elsewhere proclaiming 'gay pride' and all that.""",UNPROVEN,
A black supporter of Donald Trump was shot and killed by protesters in Chicago.,FALSE,
The Supreme Court revoked the Church of Scientology's tax-exempt status in March 2016.,FALSE,
Meg White is replacing Rush's drummer Neil Peart.,False,
Russian President Vladimir Putin endorsed Sen. Bernie Sanders for President.,False,
"Bernie Sanders has not released the transcripts for speeches he gave to major financial institutions, despite calling on Hillary Clinton to do so.",False,
A Wendy's employee admitted that was putting feces in the restaurant's chili.,FALSE,
A video shows Secret Service agents practicing for advanced reverse escapes at a racetrack.,FALSE,
Parents should be aware that a code for pedophiles inexplicably showed up on a children's toy at motorsport event Monster Jam.,Mostly False,
Singer Adele died in a car crash in March 2016.,FALSE,
A woman murdered her college roommate over too many Candy Crush requests.,FALSE,
Ronald Reagan met with the Taliban in 1985 and compared them to the founding fathers of the United States.,FALSE,
Bernie Sanders was omitted from the Chicago primary ballot.,False,
Singer James Hetfield left the band Metallica and has announced a new country music album.,FALSE,
"Photograph shows Donald Trump supporters wearing ""Make America White Again"" shirts at a rally.",False,
The volume of Americans researching the details of immigrating to Canada was so high on Super Tuesday that it temporarily crashed the country's immigration site.,Mixture,
The movie 'The Notebook 2' has started filming in various US cities.,FALSE,
A 1964 campaign ad for President Lyndon B. Johnson featured a purported Republican voter expressing concerns which eerily echoed threads of debate in the GOP in 2016.,True,
A video shows a surfer being towed by a great white shark.,FALSE,
"President Obama ordered flags be flown at half-staff to mark the death of singer Whitney Houston, but he did not extend that honor to former first lady Nancy Reagan.",False,
A massive recall of chicken nuggets is underway after authorities in Iowa found human remains in a meat processing facility.,False,
"President Obama opted to skip Nancy Reagan's funeral in order to ""party"" at an ""entertainment festival.""",Mixture,
A photograph shows a crowd with their hands raised pledging allegiance to President Obama.,FALSE,
Donald Trump encouraged supporters to engage in a Nazi-style salute at a campaign rally.,Mostly False,
"Bernie Sanders called for ""chemtrail reform"" during a campaign stop in Nevada.",False,
Bernie Sanders said that white people don't know what it is like to be poor.,MIXTURE,
Keanu Reeves lamented the objectification of women in an uncharacteristic way.,False,
"Netflix released a promotional image for its upcoming series ""Home Improvementer"".",FALSE,
Students at Bowdoin College in Maine were offered counseling because a party involved mini sombreros.,Mostly False,
Donald Trump tweeted an image of his genitals following penis-related banter at a Republican debate.,False,
"Police in Collin County, Texas have quietly warned of serial kidnappings at local Target and Walmart locations.",False,
"A casting call for a Latina actress to play a ""Donald Trump Executive Assistant Supporter"" was posted by the republican presidential candidate.",MIXTURE,
Germany has banned pork from school canteens because it offends Muslim 'migrants.',Mostly False,
Contoversial pharmaceuticals trader Martin Shkreli was shot and killed.,False,
A Fairfax County schoolteacher informed a student's mother that her black child was singled out by other students as likely to be deported if Donald Trump were elected.,True,
Eleven states are implementing motorcycle curfews with stiff penalties for violators.,False,
A photograph shows Republican presidential candidate Ted Cruz hugging Fidel Castro.,FALSE,
Photograph depicts fetuses found in a Chinese food restaurant's freezer.,False,
An image shows a real ad from The Brady Campaign urging citizens not to fight back against home intruders.,FALSE,
"A well-known celebrity is moving to your town after briefly visiting and discovering ""people were people,"" ""whose sincerity you didn’t have to question.""",False,
Billionaire Vijay Mallya found cheap parking in New York by using his expensive car as collateral for a loan.,FALSE,
A young Marine was discharged after footage of his involvement in a racially charged altercation at a Donald Trump rally surfaced.,Mostly True,
A photograph shows a newly hatched baby dragon.,FALSE,
"As the Nazi Party rose to power, Hitler used the slogan ""Make Germany Great Again.""",MIXTURE,
A bloody knife was recently uncovered on the grounds of O.J. Simpson's former home.,Mixture,
